{
  "schemaVersion": "0.1",
  "graphId": "orderly",
  "name": "Orderly",
  "description": "Hand-authored app graph for a small Uno Platform ordering app. Three features, five screens, four MVUX models (CartViewModel is shared by Cart and Checkout), one shared OrderLineRow component with three uses, six routes, twelve declared states, one inferred relationship.",
  "entry": "screen.catalog",
  "files": [
    {
      "id": "f.app", "path": "Orderly/App.xaml.cs", "language": "csharp", "startLine": 60,
      "lines": [
        "        private static void RegisterRoutes(IViewRegistry views, IRouteRegistry routes)",
        "        {",
        "            views.Register(",
        "                new ViewMap(ViewModel: typeof(ShellViewModel)),",
        "                new ViewMap<CatalogPage, CatalogViewModel>(),",
        "                new ViewMap<ProductPage, ProductViewModel>(Data: new DataMap<Product>()),",
        "                new ViewMap<CartPage, CartViewModel>(),",
        "                new ViewMap<CheckoutPage, CartViewModel>(),",
        "                new ViewMap<OrdersPage, OrdersViewModel>()",
        "            );",
        "",
        "            routes.Register(",
        "                new RouteMap(\"\", View: views.FindByViewModel<ShellViewModel>(),",
        "                    Nested:",
        "                    [",
        "                        new (\"Catalog\", View: views.FindByView<CatalogPage>(), IsDefault: true),",
        "                        new (\"Product\", View: views.FindByView<ProductPage>()),",
        "                        new (\"Cart\", View: views.FindByView<CartPage>()),",
        "                        new (\"Checkout\", View: views.FindByView<CheckoutPage>()),",
        "                        new (\"Orders\", View: views.FindByView<OrdersPage>()),",
        "                    ]",
        "                )",
        "            );",
        "        }"
      ]
    },
    {
      "id": "f.catalog-xaml", "path": "Orderly/Presentation/CatalogPage.xaml", "language": "xaml", "startLine": 1,
      "lines": [
        "<Page x:Class=\"Orderly.Presentation.CatalogPage\"",
        "      xmlns=\"http://schemas.microsoft.com/winfx/2006/xaml/presentation\"",
        "      xmlns:x=\"http://schemas.microsoft.com/winfx/2006/xaml\"",
        "      xmlns:uen=\"using:Uno.Extensions.Navigation.UI\"",
        "      xmlns:mvux=\"using:Uno.Extensions.Reactive.UI\">",
        "  <Grid RowDefinitions=\"Auto,Auto,*\" Padding=\"16\" RowSpacing=\"12\">",
        "    <TextBlock Text=\"Orderly\" Style=\"{StaticResource TitleLargeTextBlockStyle}\" />",
        "    <Button x:Name=\"CartButton\"",
        "            HorizontalAlignment=\"Right\"",
        "            uen:Navigation.Request=\"Cart\"",
        "            Content=\"{Binding CartCount, Converter={StaticResource CartLabelConverter}}\" />",
        "    <TextBox Grid.Row=\"1\" x:Name=\"SearchBox\"",
        "             PlaceholderText=\"Search products\"",
        "             Text=\"{Binding Query, Mode=TwoWay}\" />",
        "    <mvux:FeedView Grid.Row=\"2\" x:Name=\"ProductFeed\" Source=\"{Binding Products}\">",
        "      <DataTemplate>",
        "        <ListView x:Name=\"ProductList\"",
        "                  ItemsSource=\"{Binding Data}\"",
        "                  uen:Navigation.Request=\"Product\"",
        "                  ItemTemplate=\"{StaticResource ProductCardTemplate}\" />",
        "      </DataTemplate>",
        "      <mvux:FeedView.ProgressTemplate>",
        "        <DataTemplate><ProgressRing IsActive=\"True\" /></DataTemplate>",
        "      </mvux:FeedView.ProgressTemplate>",
        "      <mvux:FeedView.NoneTemplate>",
        "        <DataTemplate><TextBlock Text=\"No products yet\" /></DataTemplate>",
        "      </mvux:FeedView.NoneTemplate>",
        "      <mvux:FeedView.ErrorTemplate>",
        "        <DataTemplate><InfoBar Severity=\"Error\" IsOpen=\"True\" Message=\"Couldn't load products\" /></DataTemplate>",
        "      </mvux:FeedView.ErrorTemplate>",
        "    </mvux:FeedView>",
        "  </Grid>",
        "</Page>"
      ]
    },
    {
      "id": "f.catalog-vm", "path": "Orderly/Presentation/CatalogModel.cs", "language": "csharp", "startLine": 1,
      "lines": [
        "namespace Orderly.Presentation;",
        "",
        "public partial record CatalogModel(ICatalogService Catalog, ICartService Cart)",
        "{",
        "    public IState<string> Query => State<string>.Value(this, () => string.Empty);",
        "",
        "    public IListFeed<Product> Products => Query",
        "        .SelectAsync(Catalog.SearchAsync)",
        "        .AsListFeed();",
        "",
        "    public IFeed<int> CartCount => Cart.Items.Select(items => items.Sum(i => i.Quantity));",
        "}"
      ]
    },
    {
      "id": "f.product-xaml", "path": "Orderly/Presentation/ProductPage.xaml", "language": "xaml", "startLine": 1,
      "lines": [
        "<Page x:Class=\"Orderly.Presentation.ProductPage\"",
        "      xmlns=\"http://schemas.microsoft.com/winfx/2006/xaml/presentation\"",
        "      xmlns:x=\"http://schemas.microsoft.com/winfx/2006/xaml\"",
        "      xmlns:utu=\"using:Uno.Toolkit.UI\">",
        "  <StackPanel Padding=\"16\" Spacing=\"12\">",
        "    <Image x:Name=\"HeroImage\" Source=\"{Binding Product.ImageUrl}\" Height=\"220\" Stretch=\"UniformToFill\" />",
        "    <TextBlock x:Name=\"NameText\" Text=\"{Binding Product.Name}\" Style=\"{StaticResource TitleMediumTextBlockStyle}\" />",
        "    <TextBlock x:Name=\"PriceText\" Text=\"{Binding Product.Price, Converter={StaticResource CurrencyConverter}}\" />",
        "    <TextBlock Text=\"{Binding Product.Description}\" TextWrapping=\"Wrap\" Opacity=\"0.8\" />",
        "    <NumberBox x:Name=\"QuantityBox\" Header=\"Quantity\" Minimum=\"1\" Maximum=\"9\"",
        "               SpinButtonPlacementMode=\"Inline\"",
        "               Value=\"{Binding Quantity, Mode=TwoWay}\" />",
        "    <Button x:Name=\"AddToCartButton\"",
        "            Style=\"{StaticResource FilledButtonStyle}\"",
        "            HorizontalAlignment=\"Stretch\"",
        "            Command=\"{Binding AddToCart}\"",
        "            Content=\"{Binding AddLabel}\" />",
        "  </StackPanel>",
        "</Page>"
      ]
    },
    {
      "id": "f.product-vm", "path": "Orderly/Presentation/ProductModel.cs", "language": "csharp", "startLine": 1,
      "lines": [
        "namespace Orderly.Presentation;",
        "",
        "public partial record ProductModel(Product Product, ICartService Cart, INavigator Navigator)",
        "{",
        "    public IState<int> Quantity => State.Value(this, () => 1);",
        "",
        "    public IState<string> AddLabel => State.Value(this, () => \"Add to cart\");",
        "",
        "    public async ValueTask AddToCart(CancellationToken ct)",
        "    {",
        "        var qty = await Quantity;",
        "        await Cart.AddAsync(Product, qty, ct);",
        "        await AddLabel.SetAsync(\"Added\", ct);",
        "        await Task.Delay(600, ct);",
        "        await Navigator.NavigateViewModelAsync<CartViewModel>(this, cancellation: ct);",
        "    }",
        "}"
      ]
    },
    {
      "id": "f.order-line-row", "path": "Orderly/Controls/OrderLineRow.xaml", "language": "xaml", "startLine": 1,
      "lines": [
        "<UserControl x:Class=\"Orderly.Controls.OrderLineRow\"",
        "             xmlns=\"http://schemas.microsoft.com/winfx/2006/xaml/presentation\"",
        "             xmlns:x=\"http://schemas.microsoft.com/winfx/2006/xaml\">",
        "  <Grid ColumnDefinitions=\"48,*,Auto,Auto,Auto\" ColumnSpacing=\"12\" Padding=\"0,8\">",
        "    <Image Source=\"{Binding ImageUrl}\" Width=\"48\" Height=\"48\" />",
        "    <TextBlock Grid.Column=\"1\" Text=\"{Binding Name}\" VerticalAlignment=\"Center\" />",
        "    <TextBlock Grid.Column=\"2\" Text=\"{Binding Quantity, Converter={StaticResource QtyConverter}}\" />",
        "    <TextBlock Grid.Column=\"3\" Text=\"{Binding Total, Converter={StaticResource CurrencyConverter}}\" />",
        "    <Button Grid.Column=\"4\" x:Name=\"RemoveButton\"",
        "            Visibility=\"{x:Bind ShowRemove, Mode=OneWay}\"",
        "            Command=\"{x:Bind RemoveCommand, Mode=OneWay}\"",
        "            Content=\"&#xE74D;\" FontFamily=\"{StaticResource SymbolThemeFontFamily}\" />",
        "  </Grid>",
        "</UserControl>"
      ]
    },
    {
      "id": "f.cart-xaml", "path": "Orderly/Presentation/CartPage.xaml", "language": "xaml", "startLine": 1,
      "lines": [
        "<Page x:Class=\"Orderly.Presentation.CartPage\"",
        "      xmlns=\"http://schemas.microsoft.com/winfx/2006/xaml/presentation\"",
        "      xmlns:x=\"http://schemas.microsoft.com/winfx/2006/xaml\"",
        "      xmlns:uen=\"using:Uno.Extensions.Navigation.UI\"",
        "      xmlns:controls=\"using:Orderly.Controls\">",
        "  <Grid RowDefinitions=\"Auto,*,Auto,Auto\" Padding=\"16\" RowSpacing=\"12\">",
        "    <TextBlock Text=\"Cart\" Style=\"{StaticResource TitleLargeTextBlockStyle}\" />",
        "    <ListView Grid.Row=\"1\" x:Name=\"LinesList\" ItemsSource=\"{Binding Items}\">",
        "      <ListView.ItemTemplate>",
        "        <DataTemplate>",
        "          <controls:OrderLineRow ShowRemove=\"True\"",
        "                                 RemoveCommand=\"{Binding DataContext.RemoveLine, ElementName=LinesList}\" />",
        "        </DataTemplate>",
        "      </ListView.ItemTemplate>",
        "    </ListView>",
        "    <TextBlock Grid.Row=\"1\" Text=\"Your cart is empty\"",
        "               HorizontalAlignment=\"Center\" VerticalAlignment=\"Center\"",